<?xml version="1.0" encoding="UTF-8" standalone="no" ?>
<!DOCTYPE niveau SYSTEM "niveau.dtd">

<niveau>

	<informations>
		<titre>Niveau 1</titre>
		<description>Un niveau de test</description>
	</informations>

	<proprietes>
		<background>chemin_image.jpg</background>
		<!--<musique>chemin_musique.mp3</musique>-->
	</proprietes>

	<conditions>
		<dureeMax>100</duree>
		<pointsMax>1000</points>
		<asteroidesMax>10</asteroides>
	</conditions>

	<apparition>
		<cycle unite="ms">1000</cycle> <!-- temps entre chaque apparition -->
		<probabilite>0.5</probabilite> <!-- probabilité d'apparition d'un asteroide -->
		<min>0</min> <!-- nombre d'asteroides min sur l'écran -->
		<max>5</max> <!-- nombre d'asteroides max sur l'écran -->
	</apparition>

	<asteroides> <!-- futur nom : obstacles ? -->
		<!-- remplacer par juste le nom de l'asteroide ? "ast1" -->
		<asteroide probabilite="0.2">asteroides/ast1.xml</asteroide>
		<asteroide probabilite="0.2">asteroides/ast2.xml</asteroide>
		<asteroide probabilite="0.2">asteroides/ast3.xml</asteroide>
		<asteroide probabilite="0.2">asteroides/ast4.xml</asteroide>
		<asteroide probabilite="0.2">asteroides/ast5.xml</asteroide>
	</asteroides>

</niveau>
